title	plot	set"The Beast From 20,000 Fathoms"	"The opening title is against a waterspout and the credits over a kelp forest and other underwater scenes. Narration tells us, ""This is operation experiment, a secret base far north of the Arctic Circle. Experiment was the code name for this top priority scientific expedition."" Two radar operators (Alvin Greenman) and Charlie (James Best) spot the plane on radar and reports its location. Prof. Tom Nesbitt (Paul Christian/Hubschmid) and the military liaison officer Col. Jack Evans (Kenneth Tobey) observe the explosion of a Hydrogen Bomb. Charlie calls Col. Evans to report a very large object spotted on radar, but by the time Evans arrives it's gone. They chalk it up to something being tossed in front of the radar antenna.Nesbitt and Evans are reviewing their test results. George Ritchie (Ross Elliott) states, ""You know, every time one of these things go off, I feel as if were helping to write the first chapter of a new Genesis."" They depart to collect radiation results from forward observation posts. Ice blocks their path by tractor, so they go on foot the final distance. At Post 16 they take a radiation reading and decide it's too high. They decide they should split up; one visit Post 17 and the other Post 18 to limit their radiation exposure. They agree to meet back at Post 16. The weather gets worse. Ritchie spots a large dinosaur and hears its roar. He shouts out to his colleague, but Tom Nesbitt can't hear him. He explores a little further and distracted by the beast falls into a crevice, breaking his leg in the process. Nesbitt completes his task and returns to Post 16 and waits. Ritchie shoots a gun into the air, hoping its loud report will bring help. Nesbitt hears it and responds. Following his tracks left in the snow he finds his colleague. He tries to move him alone, but decides he needs more help. Ritchie tries to warn Nesbitt about ""a prehistoric monster."" Nesbitt attributes his rambling to the cold, pain, and shock. Then Nesbitt hears and sees Ritchie's ""hallucination"" himself. The creature's proximity and weight creates an avalanche that buries Ritchie and nearly kills Nesbitt. Nesbitt is brought back to base, barely alive from shock and exposure. The doctor tells Col. Evans to get him to a hospital in the states immediately. Nesbitt comes to and begins to ramble about Ritchie and a monster. He is flown to New York's Hartley Hospital. After a two week physical recovery he is started on ""Psychiatric Interrogation for Traumatic Hallucinations."" He is introduced to Dr. Ingersoll (King Donovan) who tells him that shock and trauma are the reason behind his dinosaur sighting. Col. Evans arrives to tell him that they found no trace of Ritchie or the beast. His primary care physician, Dr. Morton (Frank Ferguson) insists he rest.The fishing ketch, Fortune, is out in a storm in the North Atlantic. The captain enters the wheelhouse, his first mate Jacob Bowman (Jack Pennick) is at the wheel. Bowman spots something outside and calls for the Captain, abandoning the wheel as he recoils in fear. They hear a roar and see a huge black shape rise up from the ocean. It destroys their vessel and sinks it off the Grand Banks.The next morning Nesbitt is having his breakfast in his hospital room and spots the story in the newspaper. Bowman was the lone survivor of the disaster. Nesbitt dresses and visits the Paleontology Department of a local University. He talks to the department dean, Prof. Thurgood Elson (Cecil Kellaway) and his assistant Miss Lee Hunter (Paula Raymond). Elson is sympathetic but does not believe his story. Nesbitt asks if it is possible that the H-Bomb thawed the 100 million year old ice and freed the dinosaur. Elson does not think it possible a creature frozen for that length of time could survive. Lee Hunter interrupts to mention that a herd of Mastadon were thawed in Siberia after thousands of years, ""yet their fur intact and the meat still edible."" Nesbitt leaves dejected. Dr. Morton examines Nesbitt and tells him he can leave the hospital anytime. The radio is playing in his room and a broadcaster announces a second sea serpent sighting, this time from Marquette, Canada. Capt. George LeMay's ship was destroyed.Nesbitt returns to work at the Atomic Energy Commission, New York Regional Office. His secretary, Miss Ryan, is glad to have him back. She tells him that Lee Hunter is waiting to see him. She brings the newspaper with the LeMay story and tells him it is worth investigating. She's gathered sketches of the known species of dinosaurs and tells him if he can identify the creature that would be proof. That evening they meet at her apartment to look at the sketches. He narrows in on a few likely candidates, and she helps him identify the one he picks as the Rhedosaurus. She tells him if Capt. LeMay can identify the same sketch that would be proof. He calls Canada to talk to the Captain. LeMay (Leo Mostovoy) answers but can only speak French. Nesbitt asks him about the serpent, and the captain promptly hangs up the phone. The operator tells Nesbitt that he won't talk to him further. Nesbitt makes a personal visit but misses him. He speaks to the newspaper editor. He decides to visit Jacob Bowman in the hospital. He convinces Bowman to return to New York and identify the creature.Elson is packing for a vacation; Lee is helping him. He notes that Lee is developing a budding romance with Nesbitt. Nesbitt arrives with Bowman in tow. Bowman reviews the sketches and picks the same creature--the Rhedosaurus. Elson is now convinced, and speaks to Col. Evans on the phone. Evans tells Elson he will check with a friend in the Coast Guard if anything unusual is reported.A lighthouse on the coast of Maine contains a keeper and his assistant. One plays a concertina while the other wipes down the equipment. The creature comes ashore and climbs up the lighthouse, drawn to the beacon. They see it and try to escape down the spiral staircase, but the creature destroys it before they can safely exit.Col. Evans pays a visit to Capt. Philip Jackson (Donald Woods) at his U.S. Coast Guard office. He tells him the story Nesbitt and Elson told him. He asks about any unusual occurrences. That evening at the ballet, Nesbitt and Lee are on a date when Nesbitt is handed a message. They quickly depart and meet with Elson and Evans at Jacksons USCG office. Jackson explains that in addition to the lighthouse, there was shore wreckage in Massachusetts reported. Elson looks at the chart and sees a pattern. It is following the Arctic Current southward. He concludes the beast is heading for New York, its ancestral home. Elson wants to see it before he can formulate a plan to capture the creature alive. He makes arrangements with Jackson for the use of a diving bell.On the ship Elson boards a diving bell for their first drop into the Hudson submarine canyon system. Elson is in communication with Nesbitt on the surface and provides periodic reports of progress. He spots the Rhedosaurus, only the shoulder and the leg, but confirms it is enormous. Then as he describes it to Lee Hunter in more detail, it attacks and chews off the bell from the cable. The newspaper story the next day confirms Elson's death.Longshoremen are working at a New York port facility when the Rhedosaurus comes ashore. What starts as a few people scattering turns into a mob in full panic. People stuck in buildings look on in horror at the panic in the streets and the beast's destruction of property. People abandon their cars on the street and run. A patrolman shoots it with his service revolver, with little effect other than annoying the beast. As he reloads the dinosaur bends down and latches on to him by the head. He lifts him up and swallows him whole to the shock and horror of a woman witness. As it walks the streets of New York it destroys cars, utility poles and buildings. The police respond with greater numbers and rifles. Many people seek refuge in the subway system. The National Guard is called out and the Wall Street and Lower Manhattan area is turned into a battlefield. A newspaper headline indicates 180 dead and 1500 injured during the first rampage. A bazooka team fires a couple of rounds wounding the beast in the neck. The ER doctor (Michael Fox) has concluded that the beast has some very dangerous virus or bacteria in its blood that is fatal to humans. A patrol of soldiers begins collapsing after exposure to large patches of the creature's blood.Evans and Nesbitt discuss how to eliminate the beast. Anything that will spread the blood particles is out. Just as they think the creature may be dying of its wound, it is announced that the beast is alive and ashore at Manhattan Beach at the amusement area. Nesbitt suggests a radioactive isotope shot directly into the wound.The Army arrives at the amusement park. The Rhedosaurus is at the Roller Coaster. They wait for the isotope to be delivered. Evans selects his best marksman, Corp. Stone (Lee Van Cleef) for the job. He and Nesbitt don radiation suits and take a roller coaster car to the top for a better shot. Nesbitt retrieves the isotope from a lead lined container and Stone fires it into the beast's neck wound. He scores a direct hit and the beast, now in great pain, damages some of the wooden framework and rails. The coaster they were riding gets away from them, crashes, and starts a fire. The two men climb down the burning coaster while the beast goes through its death throes. The Rhedosaurus knocks out a section of burning coaster framework and makes its way to the beach and collapses. We close with Nesbitt and Lee embracing, then turning to view the dead dinosaur."	earthMetropolis	"The film is set in the year 2026, in the extraordinary Gothic skyscrapers of a corporate city-state, the Metropolis of the title. Society has been divided into two rigid groups: one of planners or thinkers, who live in luxury on the surface of Earth, and another of workers who live underground toiling to sustain the lives of the privileged up above. The city is run by Johann 'Joh' Fredersen (Alfred Abel).The beautiful and evangelical figure Maria (Brigitte Helm) takes up the cause of the workers. She advises the desperate workers not to start a revolution, and instead wait for the arrival of ""The Mediator"", who, she says, will unite the two halves of society. The son of Fredersen, Freder (Gustav Fröhlich), becomes infatuated with Maria, and follows her down into the working underworld. In the underworld, he experiences firsthand the toiling lifestyle of the workers, and observes the casual attitude of their employers (he is disgusted after seeing an explosion at the ""M-Machine"", when the employers bring in new workers to keep the machine running before taking care of the men wounded or killed in the accident). Shocked at the workers' living conditions, he joins her cause.Meanwhile his father Fredersen consults with the scientist Rotwang (Rudolf Klein-Rogge), an old companion and rival. Fredersen learns that the papers found with dead workers are plans of the catacombs and witnesses a speech by Maria. He also learns that Rotwang has built a robotic gynoid. Rotwang wants to give the robot the appearance of Hel, his former lover who left him for Fredersen and died giving birth to Freder. Fredersen persuades him to give the robot Maria's appearance, as he wants to use the robot to tighten his control over the workers. Rotwang complies out of ulterior motives: he knows of Freder's and Maria's love and wants to use the robot to deprive Fredersen of his son.The real Maria is imprisoned in Rotwang's house in Metropolis, while the robot Maria is first showcast as an exotic dancer in the upper city's Yoshiwara nightclub, fomenting discord among the rich young men of Metropolis. After descending to the worker's city, the robot Maria encourages the workers into a full-scale rebellion, and they destroy the ""Heart Machine"", the power station of the city. Neither Freder nor Grot, the foreman of the Heart Machine, can stop them. As the machine is destroyed, the city's reservoirs overflow, flooding the workers' underground city and seemingly drowning the children, who were left behind in the riot. In fact, Freder and Maria have saved them in a heroic rescue, without the workers' knowledge.When the workers realize the damage they have done and that their children are lost, they attack the upper city. Under the leadership of Grot, they chase the human Maria, whom they hold responsible for their riot. As they break into the city's entertainment district, they run into the Yoshiwara crowd and capture the robot Maria, while the human Maria manages to escape. The workers burn the captured Maria at the stake; Freder, believing this to be the human Maria, despairs but then he and the workers realize that the burned Maria is in fact a robot.Meanwhile, the human Maria is chased by Rotwang along the battlements of the city's cathedral. Freder chases after Rotwang, resulting in a climactic scene in which Joh Fredersen watches in terror as his son struggles with Rotwang on the cathedral's roof. Rotwang falls to his death, and Maria and Freder return to the street, where Freder unites Fredersen and Grot, fulfilling his role as the ""Mediator""."	earth1984	"A voice-over narrator explains that in 1955, a nuclear war and devastation of Earth gave rise to three powerful police superstates continually at war with one another: Oceania, ruled by the omnipresent Big Brother; Eurasia ruled by the communists, and finally East Asia ruled by a sub-branch of socialists. By 1984, London, with its bomb-proof ministry, was designated as the capital of Airstrip One, a province of Oceania.In the spring of 1984, as the sound of air raid sirens wail above the London streets, Winston Smith (Edmond O'Brien), a member of the elite Outer Party, takes cover in a doorway and there encounters Julia (Jan Sterling), a woman he suspects may be a member of the Thought Police. After the air raid sirens abate, Winston goes to his apartment, where an electronic surveillance eye examines the contents of his briefcase. Smuggling a small black diary past the eye, Winston begins to write down the subversive thoughts he fears to say aloud. Winston's reverie is interrupted when Selina Parsons (Carol Wolveridge), the little girl who lives next door and is training to become a spy for Big Brother, enters his apartment to practice denouncing him as a traitor. After his daughter heads off for her spy indoctrination, Parsons (Donald Pleasence), Selina's father, invites Winston to join him at the local Chestnut Tree café for some tea.At the cafe, Winston and Parsons spot Rutherford and Jones, two traitors who have been rehabilitated by the government's Ministry of Love. After Big Brother impulsively orders Rutherford and Jones's re-arrest, Winston, rattled, goes to a junk shop to wonder at the beauteous objects of yesteryear that are now deemed worthless. As the elderly proprietor (David Kossoff) shows Winston his wares, Julia enters the shop, sending Winston scurrying into the street, where he is stopped by the police and ordered to report to Administration the next morning.At the Administration the next day, a party officer reprimands Winston for mixing with the common masses (the Proles). Winston then proceeds to his job at the Records Department, where he revises history to vindicate Big Brother's pronouncements. When Winston discovers a photo that would prove Jones and Rutherford innocent, O'Connor (Michael Redgrave), Winston's superior and a minister of the exclusive Inner Party, instructs him to destroy it.That evening, at a political rally to foment hate against Eurasia, Julia passes Winston a note professing her love to him. Later, they arrange to meet Sunday in a meadow, far from the prying microphones and monitors of Big Brother. There, they touch each other, an act prohibited by the Anti-Sex League and proceed to make love (off-camera).Two weeks later, Winston and Julia meet clandestinely at a bell tower, and Winston proposes renting a room at the junk store, one of the few places free of the omnipresent monitors. The elderly proprietor honors their request and sets up a cozy bedroom and kitchen for them. In the sanctity of their quarters, after Julia removes her austere party uniform and dons a frilly blouse, Winston confides that he believes O'Connor may be a member of the Underground.One night, while leafing through his diary, Winston finds a note written in O'Connor's hand that reads ""down with Big Brother."" The next day at work, O'Connor tells Winston to come by his apartment that evening to pick up some documents. Convinced that O'Connor represents their only hope to break free of the tyranny of Big Brother, Julia and Winston go to his apartment and declare that they want to join the Underground. After drinking a toast to the demise of Big Brother, O'Connor asks if there is anything they would not do for the Underground and Julia replies that she would not be separated from Winston. O'Connor then instructs Winston to carry an empty briefcase with him at all times.During a rally to launch Hate Week, a man in the crowd switches briefcases with Winston, and when Winston opens the case, he finds a copy of a treatise by Calidor, the alleged leader of the Underground. Back in their secret room, Julia muses that only love can defeat Big Brother and thus provide hope for the future. At that moment, a telescreen hidden behind a mirror breaks its silence to condemn Julia's sentiments, after which, the police, accompanied by the elderly proprietor, burst in to arrest them.At the Ministry of Love, Winston is confined in a pit-like room for hours (and probably days). Soon after, Parsons is thrown into the pit, his daughter having denounced him for muttering in his sleep ""Down with Big Brother."" Under O'Connor's direction, Winston is subjected to a brainwashing campaign. Still resistant after a series of electroshock treatments, Winston declares that the party will never eradicate his love for Julia. O'Connor then ushers Winston into the dreaded Room 101, where each prisoner must confront their own personal terror. Having ascertained that Winston's worst fear is being eaten alive by rats, O'Connor confines him in a room filled with the squealing rodents, after which he breaks down and begs them to feed Julia to the rodents instead. His will broken, the door opens and Winston falls sobbing into O'Connor's arms.After O'Connor authorizes his release, Winston mindlessly wanders through the streets, where he spots Julia, her eyes vacant as his, seated on a bench. After they confess their mutual betrayal, Big Brother broadcasts that the Eurasian army has been routed. In the final shot, the rehabilitated and brainwashed Winston and Julia then fervently join the crowd cheering ""Long live Big Brother!"	earthOn the Beach	"The year is 1964. The nuclear war that was waged in the northern hemisphere has ended. An American nuclear submarine, The Sawfish, at sea in the mid-Pacific makes its way down the coast of Australia where there appear to be survivors. Docking at the port of Melbourne, the crew, commanded by Lt. Commander Dwight Towers (Gregory Peck) live out their lives waiting for the radioactive winds from the North to slowly make their way towards them, ending all life as we know it.The Australian Government and scientific community, hopeful that life might go on in the Southern Hemisphere or in Antarctica, ask Towers and his crew to take the sub north again to check on radiation levels and a mysterious Morse code signal emanating from near San Diego, CA. Towers is assigned an Australian Ensign (Anthony Perkins) who will act as liaison officer for the mission. Feeling sorry for Towers and the loss he has experienced up North, Perkins and his wife Mary (Donna Anderson), throw a party. They bring in a friend Moira Davidson (Ava Gardner) to distract Towers so he won't become morbid and depressed. Towers slowly begins to fall in love with Moira. However, he still has the mission to think of and is still very much devoted to his wife and kids, who resided in Connecticut. He has difficulty reconciling their loss and at one point confuses Moira for his late wife, Sharon. Moira offers to become ""Sharon"" if it will help him deal with it and also serve the purpose of assuaging her loneliness and fear of the future, impending doom awaiting. Towers refuses. He leaves on the mission north without telling Moira. She finds out from her cousin Julian Osborne (Fred Astaire in his first dramatic role,) who will be serving as a scientist checking on the radiation levels during the mission. The Sawfish first arrives at Point Barrow in the Artic Sea, only to find that the radiation levels have not subsided. Next they visit an untouched but ghostly quiet, San Francisco. One of the crew, yeoman Swain, whose hometown is San Francisco, escapes the sub through an escape hatch and swims ashore. The Sub sits on the bottom of San Francisco bay and then the next morning surfaces to find Swain fishing from a small boat. Swain tells Captain Towers he is sorry that he deserted but he would ""rather be here [sic. San Francisco] to have it"" then in Australia later on. Towers understands. The Sawfish heads south to the San Diego area and puts a Radio Officer, Lt. Sunderstrom ashore in a full radiological suit with oxygen tank. Sunderstrom discovers that the mysterious morse code signal is coming from a silent radio room at a refinery, where the window pane had broken and a window shade pull cord had wrapped around a partially empty Coca-cola bottle and a morse code key thus generating the gibberish Morse code signals. Sunderstrom signals the sub as to what he has found and then shuts down the main generators at the refinery. Resigned to their fate, the Sawfish returns and Towers meets up with Moira at her father's farm. They spend time together and go to the last Australian Grand Prix, where Osborne is racing. Osborne wins which has been his dream and Towers and Moira head off to go fishing, as the fishing season has opened early. The fishing grounds are crowded with people and they spend a stormy evening together having dinner in their room in an inn. In the background one can the hear the very audible singing of drunken locals singing the tune ""Waltzing Matilda"" in the barroom below. Returning from the fishing trip, Towers learns that one of his crew, Seaman Ackerman, has developed radiation poisoning. The radioactive-laden winds have finally arrived and he now must consider what he is going to do about his crew and about Moira. With little time left, Towers says goodbye to Osborne and speaks to his crew. They have already taken a vote and they tell him that they would like ""to head for home."" He realizes his responsibility and duty is to his crew. He phones Moira who has been helping Peter deal with Mary who can't accept the reality of their present situation. Upon learning that Towers is leaving, she speeds off in her car to the Naval Base. Mary comes around and realizes that she and Peter must face their end and that their infant daughter ""Jennifer"" will never have the chance to experience the love and happiness that she has had. She tells Peter that she has had a good life with him and that she will ""have that cup of tea now."" The tea is laced with a coma-inducing sedative, provided free to the residents of Melbourne by the government to help them deal painlessly and quickly with the end. Moira finds Towers at the dock and embraces him. He tells her he loves her but has to go with his crew. She realizes that their relationship is now over but is thankful for what they had. She speeds her car along the coast so that she can catch sight of Towers as he takes the Sawfish down for one last time. Standing on a cliff she gazes off into the distance as the submarine submerges. The final scenes are of an empty and desolate Melbourne with a banner from a religious gathering at the city's center. The banner prophetically reads ""There is still time...brother."" The final shot is a closeup of the banner. The movie ends."	earth