title	plot	setHigh Noon	"The movie opens with outlaws Jack Colby (Lee Van Cleef), Ben Miller (Sheb Wooley), and Jim Pierce (Robert Wilke) meeting up on horseback and riding into the small town of Hadleyville on a Sunday morning. As church bells ring out, the townspeople eye the notorious gang warily. Meanwhile, Marshal Will Kane (Gary Cooper) and pacifist Quaker Amy Fowler (Grace Kelly) are getting married at the Justice of the Peace office. The three outlaws ride through town and settle in outside the train depot to await the noon arrival of gang leader Frank Miller.Marshal Kane and his radiant bride are congratulated by the town mayor (Thomas Mitchell) and the retired Marshal (Lon Chaney, Jr.), and Kane reluctantly hangs up his star per his wife's wishes. Just then a telegram arrives announcing the pardon of Frank Miller, who Kane had arrested and sent to prison for murder years earlier. The station master declares that Miller is coming on the noon train. Along with the arrival of the other three outlaws, it is obvious that the Miller gang is reuniting to come after Kane and the judge who sentenced Miller. Kane and Amy are quickly hustled out of town in hopes of avoiding bloodshed. Once out on the open road, Kane suddenly turns his buckboard around and tells a bewildered Amy that he can't run from his past. Besides, the new Marshal won't arrive until the following day and the town will be defenseless. Back in town, the world-weary judge who sentenced Miller to prison is packing up his office and getting out of town. He advises Kane to do the same.Kane's hot-headed young deputy, Harvey Pell (Lloyd Bridges), who was passed over for the Marshal's job, presses Kane to turn over the reins to him and get out of town. Kane declines. Complicating things is the fact that Deputy Pell has taken up with saloon owner Helen Ramirez (Katy Jurado), a former lover of both Kane and Frank Miller. With Miller coming back, Helen Ramirez decides to sell the saloon and leave town. Determined not to be a widow, Amy Fowler also buys a ticket on the departing noon train.At the train depot, Ben Miller grows impatient and rides in to pay a visit to the town saloon, where he is welcomed like a returning hero. As Miller leaves, he runs straight into Kane and they exchange glares. Kane enters the unfriendly confines of the saloon to ask for volunteers and overhears the surly bartender speculating he will soon be shot dead. An angry Kane knocks him to the floor. The jeering saloon patrons rebuff Kane and he leaves empty handed. Kane then pays a visit to the packed church and interrupts the sermon to ask for help. A heated debate erupts among the parishioners, and a lesson in civics follows as a few brave citizens stand up for Kane and the rest find excuses to avoid conflict. The realization that he may be fighting alone begins to dawn on Kane. A visit to the retired and cynical former Marshal only produces another rejection.Meanwhile, Amy drops in on a surprised Helen Ramirez, searching for an answer to Kane's stubborn refusal to leave. Amy thinks her husband is staying because of Ramirez. Ramirez sets her straight. In a moment of weakness, Kane goes to the livery stable and thinks about saddling his horse and leaving. Deputy Pell sees him and follows him in, pressuring him to leave. When Kane resists, Harvey slugs him. A desperate fistfight ensues, which Kane wins. Kane goes to the barber's office to clean up and hears the undertaker building a coffin.Back at the Marshal's office, the one man who has volunteered to stand with Kane backs out when he discovers they will be alone. After the man leaves, Kane makes out his will and leaves it in a desk drawer. The clock ticks down the last seconds before noon. Suddenly, the shrill whistle of the approaching train sounds. The three outlaws lace up their gunbelts as the train nears. In a heartwrenching scene, Kane steps out onto the street just as Amy and Helen Ramirez drive by on their way to the station. Amy looks away, but Helen doesn't. Just as the two women arrive at the station, Frank Miller steps off the train, makes eye contact with Helen, and turns away to strap on a gun belt. In an iconic scene, the camera goes wide to reveal Marshal Kane all alone on the deserted streets.The Miller gang walks into town, where Kane is waiting. Kane catches a break when foolish Ben Miller smashes a shop window to steal a hat. Kane circles behind the gang on their blind side and calls out. When they whirl around, Kane drops Ben Miller. Amy hears the gunshot as the train pulls out and jumps off. She runs into town to find Ben Miller dead in the street. Kane is soon caught in a crossfire and takes refuge in the hayloft of the livery stable. Colby rushes the stable, only to be gunned down by Kane. The remaining two outlaws set fire to the stables and prepare to shoot Kane as he is smoked out. Kane drives the frantic horses out, concealing himself Indian-style in the midst of the fleeing horses. He escapes, but not without getting shot off his horse. The wounded Kane holes up in a small store as Miller and Pierce pour shots Into the building. Pierce stops to reload in front of the Marshal's office across the street and is suddenly shot in the back at close range. As he collapses, Amy is revealed behind the shattered window, gun in hand. Frank Miller realizes what has happened and takes Amy hostage, using her as a shield to approach Kane's position. Miller calls Kane out, threatening to kill Amy unless he shows himself. Kane lowers his gun and steps out. Knowing that Miller is about to kill her husband, Amy spins around and claws Miller's face as he throws her down. Marshal Kane quickly takes aim and kills Miller. As the townspeople flood into the street, Kane's wagon is driven up so the couple can resume their wedding journey. Will Kane surveys the ungrateful townspeople scornfully and drops his tin star into the dust."	spaceOutland	"Set in the distant future, Federal Marshal William T. O'Niel (Sean Connery), is assigned to a one-year tour of duty at Con Am 27, a titanium ore mining outpost on Jupiter's third moon Io (pronounced ""eye-oh""), a volcanic moon about 2,275 miles in diameter and located 275,000 miles from Jupiter's gas surface. Conditions on Io are difficult - gravity is 1/6th that of Earth with no breathable atmosphere, atmospheric work-suits are cumbersome, and miners carry around their own air supply whilst working. Shifts are long but significant bonuses are paid as incentives to boost production. Explaining in an opening disclaimer, Con Am 27 is franchised to Con-Amalgamate by the League of Industrial Nations located on Earth. The colony's population is 2,144 men and women (1,250 labor, 714 support personnel, and 180 administration and maintenance crew). It is policed by a force called Administrative Level 4 and above.Mark Sheppard (Peter Boyle), the head of the mining colony, boasts that since he took over the running of Io productivity has broken all previous records.The film begins with a miner named Tarlow (John Ratzenberger) suffering an attack of the DT's who rips open his work-suit which then decompresses resulting in his death. Shortly thereafter another miner Cane (Eugene Lipinski) enters a lift to the mine without wearing his work-suit, and likewise dies from decompression.With the assistance of Dr. Lazarus (Frances Sternhagen), O'Niel starts an investigation into these deaths. However, before he can complete his investigation there is a further incident, this time involving a worker Sagan (Steven Berkoff) threatening to kill a prostitute with a knife. At the scene of this incident O'Niel attempts to calm the man and enter the room by the main door, whilst Montone, O'Niel's sergeant (James B. Sikking), enters the room via the air duct. Montone shoots Sagan dead before O'Niel can talk with him.O'Niel takes a sample of blood from the dead Sagan in the morgue and has Lazarus examine it in her lab. It is here where they both discover the one thing all the deaths have in common that all of the miners had a lethal amphetamine-type drug, called ""polydichloric euthimal"" in their bloodstream. The drug allows the miners to work continuously for days at a time until they become ""burned out"" and turn psychotic. O'Niel uncovers a drug ring to distribute these drugs to the miners, run by Sheppard and effectively sanctioned by Montone.O'Niel confronts Sheppard, but the administrator smugly informs him that nobody else wants the drug shipments stopped; production is up, the workers are happy, the corporate owners (Consolidated Amalgamated) are also happy, therefore Sheppard is happy. O'Niel vows to expose the entire scheme.Meanwhile, O'Niel's wife (Kika Markham), frustrated that he considers justice more important than his family, leaves him a message pleading with him to return with her to Earth.By the use of surveillance cameras, O'Niel pursues and captures one of Sheppard's drug dealers and places him in isolation. However, before he can be questioned by O'Niel the dealer is killed. Montone is then found garroted in his quarters. O'Niel does however manage to obtain, and destroy, the latest consignment of drugs which has been hidden in a food shipment recently arrived from the Jupiter Space Station. When Sheppard is informed of this, he contacts his company rep and supplier aboard the orbiting space station about 70 hours away from Io and informs him of the situation and summons two professional hitmen to kill O'Niel, but his message is monitored by O'Niel. Sheppard also tells his unseen contact that he has an ""inside man"" also ready to kill O'Niel if need be. The company rep warns Sheppard that if his men fail to kill O'Niel, the next assassins the company sends will be coming after Sheppard.At this point, the film evolves into a 'High Noon' situation as O'Niel waits during the 70 hours it takes from the shuttle to travel from the space station to arrive at Con Am 27. The fact that the shuttle is bearing professional assassins is spread around the facility, and O'Niel's attempts to defend himself by organising resistance fall on deaf ears as no-one is prepared to risk their lives to help him. Aware that he may not survive, O'Niel last's act is to send a message to his wife and son (who left him early in the film) that he will join them on their trip home to Earth.The shuttle arrives about 42 minutes early. Over the surveillance cameras, O'Niel sees the two assassins, armed with high-tech rapid firing shotguns, separate from the rest of the miners and go hunting for O'Niel. With the sole assistance of Dr. Lazarus, O'Niel engages in a desperate kill-or-be-killed chase through the colony before dispatching the assassins. After being wounded in an ambush by one of the assassins. O'Niel dons a space suit and goes out and kills one of the assassins when Dr. Lazarus traps him in an umbilicus corridor and O'Niel depressurizes it to kill the assassin.O'Niel dispatches the next assassin who enters the colony's greenhouse and tricks him into shooting at a falling object outside the glass where the greenhouse depressurizes after one of its windows is shot out and the assassin is swept out by the vacuum to his death.But while still outside, O'Niel comes face-to-face with the last assassin: his very own Deputy Ballard (Clarke Peters), armed with a shotgun, who follows him out and attempts to kill him. O'Niel runs where he turns the tables on his traitorous deputy and engages in hand-to-hand combat after he disarms him. O'Niel pulls out an oxygen tube to the assassin's spacesuit and the deputy too dies from depressurization.Afterwords, a wounded and exhausted O'Niel confronts Sheppard in the outpost's bar where all the other colony employees have gathered and punches him out. After this, O'Niel's tour of duty is complete and he retires, leaving on the shuttle to the space station so he can accompany his family back to Earth."	spaceThe Magnificent Seven	"The farmers of the peaceful planet Akir are threatened by the space tyrant Sador (John Saxon) and his army of mutants, the Malmori. Sador's huge ship carries a weapon called a ""Stellar Converter"", which turns planets into small stars. He threatens to use the Converter unless the planet submits to him when he returns in several days. Zed (Jeff Corey), the last Akira warrior, is old and nearly blind. He suggests they hire mercenaries to protect the planet. Lacking valuable resources, they can only offer food and shelter in payment. Unable to go himself, Zed offers his ship, which has an artificial intelligence navigation and tactical computer named Nell, for the job if they can find a pilot. The ship is fast and well-armed but cannot defeat Sador alone. Shad (Richard Thomas), a young man who has piloted the ship and is well known to Nell, volunteers for the recruiting mission.Shad's first stop is the Hephaestus space station, which repairs androids. Expecting to find weapons, Shad instead finds only two humans among the androids: Doctor Hephaestus (Sam Jaffe), kept on life support, and his beautiful daughter Nanelia (Darlanne Fluegel). The doctor attempts to force Shad to mate with his daughter. Shad doesn't want to abandon his people, and escapes, with Nanelia following in her own ship. Although she has no weapons, her highly advanced computer systems might be useful. The two split up to look for more mercenaries.A little later, Shad comes across Space Cowboy (George Peppard), a spacegoing truck driver from Earth. Shad learns that Cowboy is late delivering a shipment of laser guns to a planet which, as they watch, Sador destroys with his weapon. Lacking the fuel to carry the weapons home, Cowboy offers to deliver them to Akir. Shad talks him into teaching the Akira to use the guns.Later, Shad meets a set of five alien clones who share a group consciousness named Nestor. They admit their life is incredibly dull, since their whole race shares one mind. In order to be entertained, they have sent five members to join Shad's cause. Nestor does not require payment, saying they are completely self-sufficient.Next, Shad recruits Gelt (Robert Vaughn), a wealthy assassin who is so well known he can't show his face on any civilized planet. Gelt offers his services in trade for the ability to live peacefully hiding among the Akira. Gelt's spaceship is highly maneuverable and well armed.On his way back to Akir, Shad is approached by Saint Exmin (Sybil Danning), of the Valkyrie warriors. She is a headstrong woman looking to prove herself in battle. She pilots a small, barely armed, but extremely fast spaceship. Shad finds her annoying and wishes she would go away, but she tags along.While waiting for Shad's return, Nanelia is captured by a reptilian slaver named Cayman. Cayman possesses a powerful old ship with an eclectic crew of aliens. She quickly recruits Cayman to their cause when he learns that they are looking for mercenaries to fight Sador. The only payment Cayman wants is Sador's head, since Sador's forces had destroyed Cayman's homeworld.The fleet of seven ships return to Akir. Shad takes the mercenaries down to the surface, but they are greeted with caution by the natives, who are not used to violent species. Eventually, Sador returns, but his fleet of fighters is intercepted by Shad and his new friends. In the opening battle, Gelt skillfully destroys several of Sador's ships but is mortally wounded when his ship crashes. Meanwhile, Cowboy and the Akiran natives, armed with his laser guns, fight off Sador's invading ground forces.Sador survives an assassination attempt by one of the captured Nestors and launches all of his ships in retaliation against the planet. The Akira ground troops, lead by Cowboy, defeat Sador's army, but Zed is killed in the fighting. There is another huge space battle and the mercenaries' ships are destroyed one by one. However, the mercenaries are successful in destroying all of Sador's star fighters and the Stellar Converter, leaving only Sador's flagship. Shad and Nanelia, piloting Nell, are captured by the flagship in a tractor beam. The pair escape in a lifepod after Shad orders Nell to activate the ship's self-destruct program. Sador's ship is destroyed in the explosion. As Shad and Nanelia return to Akir, Nanelia despairs over the deaths of their friends. Shad tells her that the Akira believe that no one is truly dead when they are remembered and beloved by the living. The Akira will remember the sacrifices made by the mercenaries and honor them forever."	spaceEnemy Mine	"In the distant future, as the galaxy is being colonized, humanity goes to war against the Dracs, a reptilian race from the planet Draco as both races fight over the control of many worlds. During a space battle, space pilot Willis Davidge crashes on Fryine IV, a volcanic planet. Willis finds he isn't alone and finds a Drac named Jeriba Shigan has also crashed on the planet. Both stranded on Fryine IV, Both Davidge and Jeriba both put aside their differences and their hatred for each other as they both try to survive on the planet, where they learn of each other's cultures and form a friendship."	spaceHell in the Pacific	"During World War II, a shot-down American pilot and a marooned Japanese navy captain find themselves stranded on the same small uninhabited island in the Pacific Ocean. Following war logic, each time the crafty Japanese devises something useful, he guards it to deny its use to the Yank, who then steals it, its proceeds or the idea and/or ruins it. Yet each gets his chance to kill and/or capture the other, but neither pushes this to the end. After a while of this pointless pestering, they end up joining forces to build and man a raft..."	spaceSolaris	"When the scientist Fechner disappears in the surface of the mysterious Solaris Ocean, the experienced helicopter pilot Henri Berton crosses a fog seeking out Fechner and has weird visions. His statement is presented to a commission of scientists that believe he had hallucinations. However, the widowed psychologist Kris Kelvin is assigned to the space station that orbits Solaris to check the mental health of the three remaining scientists that are still working there. He first meets Dr. Snaut, who tells him that Dr. Gibarian committed suicide, and later he meets Dr. Sartorius and he realizes that the scientists have strange behaviors. When he encounters his wife Hari, who died ten years ago, in the space station, the scientists explain to Kris that the Solaris Ocean has the ability to materialize the innermost thoughts in neutrons beings. Kris questions whether the appearance of his beloved wife is a curse or a blessing."	spaceTime After Time	"In 1893 London, England, popular writer Herbert George ""H.G."" Wells (Malcolm McDowell) displays a time machine to his skeptical dinner guests. After explaining how it works (including a ""non-return key"" that keeps the machine at the traveler's destination and a ""vaporizing equalizer"" that keeps the traveler and machine on equal terms), police constables arrive at the house searching for the serial killer Jack the Ripper. One finds a bag, with blood-stained gloves, belonging to one of Herbert's friends, a surgeon named John Leslie Stevenson (David Warner), whom they are unable to locate in the house, concluding that Stevenson might be the infamous killer. Wells races to his laboratory, but the time machine is gone.Stevenson has escaped to the future, but because he does not have the ""non-return"" key, it automatically returns to 1893. Herbert uses it to pursue Stevenson to November 5, 1979, where the machine has ended up on display at a museum in San Francisco realizing that due to the machine traveling backwards by the geographic longitide and latitude, the machine had ended up in the unfamiliar USA. As Herbert walks around the city, he is deeply shocked by the future, having expected it to be an enlightened socialist utopia, only to find chaos in the form of airplanes, automobiles and a worldwide history of war, crime and bloodshed.Searching numerous banks for Stevenson - he believes an Englishman might need to exchange old currency - Herbert meets liberated Chartered Bank of London employee Amy Robbins (Mary Steenburgen). She directs Herbert to the Hyatt Regency hotel, as she previously had Stevenson.Confronted in his room by his onetime friend Herbert, Stevenson confesses that he finds modern society to be pleasingly violent. Apologetically, he states: ""Ninety years ago, I was a freak. Now... I'm an amateur."" Herbert demands he return with him to 1893 to face justice, but Stevenson, who without the ""return key"" would be unable to prevent the machine from automatically returning (and thereby blocking Herbert from any further pursuit), attempts to wrest it from him. Their struggle is interrupted by a hotel employees and Stevenson flees, getting hit by a car during the frantic chase on foot. Herbert follows him to the San Francisco General Hospital emergency room and mistakenly gets the impression that Stevenson had died from his injuries.Herbert meets up with Amy Robbins again and she is the aggressor in a romance (succeeding, once Herbert is sure that she is in earnest). Stevenson returns to the bank to exchange more money. Rightly concluding that it was Amy who had led Herbert to him, he finds out where she lives. Herbert, hoping to convince her of the truth, takes a highly skeptical Amy three days into the future. Once there, she is aghast to see a newspaper headline revealing her own murder as the Ripper's fifth victim (a temporal paradox).Herbert persuades her that they must go back - it is their duty to attempt to prevent the fourth victim's murder, then prevent Amy's. However, they are delayed upon their return to the present and can do no more than phone the police. Stevenson kills again, and Herbert is arrested because of his knowledge of the killing. Amy is left alone, totally defenseless, and at the mercy of the ""San Francisco Ripper.""At the police station, Herbert unsuccessfully tries to convince the police of Amy's peril (his claim to be ""Sherlock Holmes"" has marked him as a lunatic well before mentioning a ""time machine""). At the same time, Amy attempts to hide from Stevenson. When the police finally do investigate her apartment, they find the dismembered body of a woman. Since he was in custody at the time Herbert is released having been cleared as a suspect. As Herbert wonders the dark streets mourning Amy's brutal death, he is suddenly confronted by Stevenson, who has actually killed Amy's co-worker Carol, who had accepted an invitation for dinner and to meet Wells. Stevenson then kidnapped Amy in order to extort the time machine key from Wells.Stevenson flees with the key - and Amy as insurance - to attempt a permanent escape in the time machine. Herbert gives chase in a car (despite not driving very well while Stevenson forces Amy to drive her car at gunpoint). Breaking into the museum, Herbert bargains for Amy's life, she is able to escape. As Stevenson starts up the time machine with the key, Herbert removes the ""vaporizing equalizer"" from the machine and Stevenson nods in understanding. The removal of this component, Herbert had confirmed earlier, causes the machine to remain in place while its passenger is sent traveling endlessly through time, with no way to stop; in effect sending him to oblivion.Herbert proclaims that the time has come to return to his own time, by himself, in order to destroy a machine that is too dangerous for primitive mankind. Amy pleads with him to take her along (despite her aversion to living in Victorian England). As they depart back to the past, she says that she is changing her name to Susan B. Anthony. The end credits reveal that the two later married."	earth