title	plot	setThe War of the Worlds	"The film begins with a voice (Sir Cedric Hardwicke) telling the audience that greedy eyes are watching the blue planet. They envy our water, clean air and plenty of resources. The race of beings watching the blue planet had considered moving to another planet in the Solar System but were unable because every other planet is uninhabitable. Also, it tells us that there has been a WWI and a WWII, but that there is going to be another kind of war, The War of the Worlds. At a time when the Earth and Mars were closest to each other in orbit, the Mars beings begin to attack. A strange fireball streaks across the southern California skies and lands in a gully in the San Gabriel mountains east of Los Angeles. Firemen quickly extinguish the fire that has broken out, but authorities are puzzled by the long, cylindrical object that fell to earth and started the fire. The object attracts tourists--and also the attention of Dr. Clayton Forester (Gene Barry) of the Pacific Technical Institute. While everyone else regards the object as anything from a tourist attraction to a potential treasure trove, Forester knows that something is wrong: the object did not come down like an ordinary meteor, and was much more lightweight than any meteor ever reported. What's more, the object is not only hot, but also radioactive.Forester stays in the nearby town at the home of Pastor Matthew Collins (Lewis Martin) and his niece, Sylvia van Buren (Ann Robinson). Three men are left in the surroundings of the object when a hidden lid on the cylinder unscrews, and a long-necked probe rises out. The three try to approach the probe, declaring their friendly intentions--and the probe spits out a heat ray that incinerates the men and starts another fire. At the same time, power and telephone service fails in town, and everyone at the social discovers that his watch has stopped. Forester determines that the watches have been somehow magnetized, and also notes that someone's pocket compass points not to the north, but to the meteorite. Forester returns to the site with the sheriff and another deputy. They find the ashes of the three men, and then the probe attacks again, killing the deputy as he tries to drive away. Forester then determines that they are dealing with something from another planet and need to call in the military, especially as another fireball lands nearby as he is talking to the sheriff. While everyone waits for the soldiers to arrive, Forester appears on a radio program and deals with the increasing speculation on the otherworldly origin of the cylinders. A consensus arises that the cylinders come from Mars, now at its closest approach to Earth.Marines from El Toro Marine Base roll in and surround the site, and an Air Force plane drops a flare on it from above. The long-necked probe fires its heat ray at the plane, and then sweeps the area, destroying a radio truck. The Marine colonel calls for reinforcements, and the 6th Army Command arrives, with artillery and tanks. Major General Mann, the commander, tells Forester that other objects like the one they are surrounding have landed in cities all over the world, and that all communication fails after that. Then the probe rises again, and we now see that it is part of a swan-like magnetically levitating low-altitude craft. Two other such craft rise out of the cylinder to join it. The officers give the order to prepare to fire, but Matthew Collins objects, saying that no one has tried to offer them peace before. Disregarding his own safety, he walks toward the three metal swans, reciting the 23rd psalm--and before his niece Sylvia's horrified eyes, the lead swan burns him to death. At once General Mann (Les Tremayne) and Marine Colonel Heffner (Vernon Rich) give the order to fire.The soldiers unleash a barrage of artillery and missile fire--and none of it is effective. The swans possess a magnetic force shield that deflects any bombardment. The swans quietly take the measure of their opponents and then start to return fire, with heat rays and meson-disrupting energy bursts that disintegrate anything they touch. Forester urges Mann to inform Washington that conventional military forces would be outmatched. Mann leaves, and Heffner fights a holding action before finally ordering a complete retreat--and being disintegrated in mid-order.Forester takes Sylvia with him in an Army plane. Flying low to avoid the Air Force jets flying in to try their hand, he clips some trees and crash-lands. He and Sylvia barely have time to escape before a squadron of swans surround the plane. General Mann returns to the city, where skeptical reporters cannot believe his reassurances--and of course he knows better, because nothing has proved effective.Alone in the brush, Forester and Sylvia take shelter in an abandoned farmhouse. There Sylvia confesses her fears and her deep sense of loss following her uncle's death. In the middle of this tender conversation, another cylinder crashes into the side of the house. Hours later, Forester wakes up, and a terrified Sylvia tells him that the house is surrounded. Forester works diligently to clear a way out, while also trying to observe as much as he can. The Martians lower a different kind of probe, an eye-like camera; Forester, at first taking this for yet another weapon, chops the camera head from its extender, which swiftly withdraws. A Martian crewman enters the house and touches Sylvia on the shoulder; Forester blinds it with a flashlight and then throws an axe at it, putting it to flight. When Forester realizes that he is holding a scarf now stained with Martian blood, Sylvia loses all control, and Forester has to shout at her to calm down. They then escape, just before the Martians burn down the ruins of the house.As more cylinders come down all over the earth, the Martians' goal becomes painfully clear: to drive all of humanity before them and eventually to kill us all. In Washington, the Secretary of Defense prepares to order the dropping of an atomic bomb on the Los Angeles-area nest. Forester and Sylvia finally arrive at Pacific Tech and turn over the alien camera and the blood-stained scarf. The blood turns out to be anemic, and the camera yields little insight other than that the Martians perceive color a lot differently from humans and that their ability to see is hampered by bright light. At the time, Pacific Tech officials think all this is a moot point, because the atom bomb is going to stop them anyway. But even the atom bomb proves ineffective against the Martians' magnetic force fields.General Mann, clearly frustrated, orders an evacuation of Los Angeles. Forester tells his colleagues that now the anemic blood is important, because only biological weapons will stop the Martians now. The plan is to take as many lab instruments as possible into the mountains and set up another laboratory. But that plan comes to nothing, as looters seize the Pacific Tech vehicles and scatter or beat up all the personnel, including Forester, the pathologist who found out about the anemia, Dr. Dupre (Ann Codee), and Sylvia. As the swans arrive and start systematically burning every building in sight, Forester rushes about, going from church to church, hoping to find Sylvia waiting there, as she once waited after running away as a child. He finds church pastors everywhere praying for deliverance, comfort, or both, and at one church he even finds two of his colleagues. At last he finds Sylvia--and as the two rush toward one another, a nearby swan burns out a stained-glass window, frightening everyone inside.But the attacking swan abruptly heels over, fires only two more seemingly half-hearted bursts, and then crashes into a building and falls to the street. Dead silence descends. Inside the church, Forester leads the people out into the street to see what has happened. They find the downed swan, and as they watch, a door opens and a Martian arm appears, trying to move out. Another swan crashes on the other side of the street and, as Forester watches, the Martian arm turns a mottled gray and falls still. Forester touches it and pronounces it dead.And in fact, this story is repeating itself everywhere. The Martians had very underdeveloped immune systems, and as soon as they were exposed to Earth's atmosphere, they became infected with germs that a humans have long since developed immunity to, but which proved uniformly fatal to Martians. The metal swans stop and fall where they are, and the invasion is over even more swiftly than it began."	spaceDeep Impact	"A young man who's part of his school's astronomy club sees something in the sky that is not known. So they take a picture of it and send it to their adviser who, upon seeing it, jumps into his car and crashes. A year later a reporter who's investigating why a member of the President's cabinet resigns when she goes to speak to him he says he wants to be with his family. Later she's brought before the President who asks her to keep what she knows under wraps for now. She convinces him to call a Press Conference so that he can tell everyone what's going on. Later at a Press Conference, the President announces that a year ago that two astronomers discovered something; a comet. And eventually that it's course will take it to earth but the problem is that the comet is so big that if it strikes it will cause what is known as an Extinction Level Event which will wipe out all life on the planet. And he announces that for sometime the government along with a few others have been building a vessel that will sent to intercept the comet. The reporter then asks the President if the reason why his Cabinet member resigned is because he doesn't believe the plan will work. The President assures them that they have thought it out carefully. In the meantime the young man who found the comet is being hailed as a hero. And the crew who's going to stop the comet makes their farewells to their families."	spaceArmageddon	"An opening narration (by Charlton Heston) recounts the history of a asteroid impact on Earth roughly 65 million years ago. The asteroid, measuring only about six miles wide, impacted near the Yucatan Peninsula and cause an extinction-level event that killed nearly all life on Earth. The narrator warns that the likelihood of such an event happening again is very probable.While fixing a satellite in orbit, the Space Shuttle Atlantis is destroyed by a meteor shower, killing the entire crew. Meteorites then bombard New York City and several other parts of the world, and NASA discovers that an asteroid the size of Texas, traveling at 22,000 miles per hour, will collide with Earth in 18 days, effectively destroying the planet. The scientists at NASA - in cooperation with the Russian, Japanese and French space agencies - plan to detonate a nuclear bomb at a precise point under the asteroid's surface which will split it in two, and cause it to miss the Earth. However, the bombs must be planted at least 800 feet below the surface within eight hours of landing, and no later than four hours before the Earth impact. The mission is not revealed to the public, fearing panic.NASA locates Harry Stamper (Bruce Willis), regarded as the world's best deep-core oil driller, to train NASA astronauts for the drilling. When invited to NASA, Harry brings his 20-something daughter Grace (Liv Tyler) to keep her away from A.J. (Ben Affleck), a young, rambunctious member of his crew who, he has just discovered, has been sleeping with her. Harry is disappointed and infuriated because he did not want his daughter to marry an oil driller like himself or remain in the blue collar life. Head of NASA Dan Truman (Billy Bob Thornton) informs Harry of the dire situation. After hearing Truman's grim scenario, Harry asks if the only job will be to drill the hole and put the bombs down. Truman assures Harry that the only job will be to drill, and no spacewalks or other astronaut duties will be involved, and Harry decides to recruit his own oil-drilling crew for the job to ensure it is done properly. After Harry's crew (Jayotis ""Bear"" Kurleenbear, Max Lennert, Rockhound, Oscar Choice, Charles ""Chick"" Chapple and some others) is collected, they are informed by Harry & NASA of the grim situation they - and the world - are faced with. The men agree to do it, provided NASA grants their demands - and are put through a 12-day training program. They meet their mission commanders; Col. Willie Sharp, USAF (William Fichtner) and NASA pilot Jennifer Watts (Jessica Steen) will command the X-71 Space Shuttle 'Freedom', while Col. Davis, USAF (Marshall Teague) and NASA pilot Tucker (Anthony Guidera) will command the other shuttle, the 'Independence'. The men are introduced to a massive, tank-like drilling rig called the 'Armadillo', one of which will be carried on each Shuttle, and the men outfit the Armadillos with the proper equipment.After a meteorite strikes Shanghai, China, destroying the city and causing a tsunami, the incoming asteroid and pending mission are revealed to the world. The Freedom and Independence are launched and dock at a Russian space station (crewed by Lev Andropov) to refuel with liquid oxygen propellant. A.J. encounters a problem stopping the pumps after the ships' tanks are full, and the crews are forced to quickly evacuate back to their shuttles and flee as the station explodes. The crews and Lev Andropov escape. Several hours later, the two shuttles perform a high G-force powered slingshot procedure around the Moon, traveling at 22,500 miles per hour to intercept the asteroid.Entering the asteroid's wake, the Independence is struck by debris, crippling its main thrusters. Col. Davis orders A.J. and his men to don their own oxygen supply & lock themselves in the cargo bay with the Armadillo. As they do, a huge piece of debris smashes out the Independence's cockpit windows and Col. Davis & pilot Tucker are killed in the decompression. In the Freedom, following, Harry sees a writhing, twisting shape and screams, 'Sharp what the hell is that? Is that the Independence?'; his question is answered with a loud 'BANG' as a body hits the Freedom's front window. Col. Sharp informs Houston of the loss of the Independence and, presumably, its crew. The crippled Independence crash-lands on the asteroid, killing most of its crew, including Oscar Choice and Freddie Noonan. AJ, Lev and Bear survive. The Freedom lands on the surface but misses the target landing zone, arriving on an area of hard iron which will be difficult to drill through. The Freedom team tries to drill but suffers several setbacks and losses due to unexpected conditions -- their first drill-head is destroyed after only a few yards and they blow a transmission, forcing a lengthy swap with a new one.A.J., Andropov, and Bear board the Armadillo, which somehow survived the crash intact, and A.J. starts following a signal on the vehicle's tracking screen, which he hopes will lead them to the Freedom - and Harry's crew. The men are forced to attempt an Evel Knievel-like jump across a massive gorge on the asteroid, and thanks to some heroics from Andropov, they succeed and carry on towards the signal.After losing communication with Earth, the drilling mission is put on hold -- Harry's crew has only reached a depth of 57 feet after two hours of work. Sharp contacts NASA for instructions -- the US President orders that the bomb be detonated on the surface in the hopes that the explosion will divert the asteroid away from Earth. The bomb's timer is activated. A surface explosion, however, would not be sufficient to divert the asteroid. Truman manages to buy some time by having a NASA controller kill the uplink for the detonator, but the controller is quickly set upon by USAF security officials and the timer is re-activated. On the Freedom, Chick sees the bomb timer counting down, and Harry summons Col. Sharp. The Colonel informs him of the 'Secondary Protocol' which he is under orders to protect, to allow the device to detonate on the surface. After overpowering Sharp, Harry convinces the Colonel that he will drill to 800 feet, no matter what, and Sharp responds, ""Then let's turn this bomb OFF!"", and de-activates the bomb. Sharp then joins Harry's men to help them attempt to finish the job. With just 250 feet left to drill, their drilling machine is blasted off the asteroid by a gas vent, killing Max in the process. When the crew radio report to NASA that the mission has failed, worldwide panic ensues as humanity braces for the end of the world. A massive meteoroid then strikes Paris, destroying most of the city.Not long after Paris is struck, the Freedom crew is trying to figure out what to do next when Harry spots a light on the side of his visor. He turns around to see the lights of a vehicle on the cliff above them. It is the second Armadillo, driven to the site by the survivors of the Independence. Harry puts A.J. in charge of finishing the drilling and they successfully drill to the necessary depth. The team lowers the nuclear bomb into the hole, but are caught in a rockstorm. The storm kills crew member Gruber and damages the remote on the bomb, rendering remote detonation useless. With 18 minutes left, Truman tells the team that someone must stay behind to detonate the bomb. Sharp & Watts must stay to fly the shuttle home, so the remaining men draw straws. A.J. is chosen after drawing straws, and Col. Sharp demonstrates to A.J. how to manually activate the detonator. Harry volunteers to take A.J. down, and when the elevator reaches the bottom Harry disables A.J.'s air supply and takes his place. The Freedom tries to leave but experiences engine failure, and once again Andropov comes to the rescue and gets the shuttle's thrusters & main engines going again. Harry sends a message to his daughter from the Armadillo's video feed, giving his full support for her to marry A.J. Seconds later, the Freedom races away from the asteroid, and Colonel Sharp whispers a final goodbye - and thank-you - to Harry.Harry detonates the bomb exactly at the deadline, causing the asteroid to split in two and miss the Earth by 400 miles, at the cost of his own life. In the wake of one of the massive pieces is the Freedom, heading for home. On the ground, celebrations take place around the world that the asteroid threat is gone. The remaining men & women of Freedom and Independence return to Earth as heroes. As the Freedom touches down at KSC, it is met with the fire crews and families of the astronauts. A.J. reunites with Grace; Chick is met by his son and former wife; Rockhound is met by Molly Mounds - a stripper he had met the night before leaving on the mission; Col. Sharp meets with Grace and offers his gratitude - and admiration - for her father's bravery & selflessness. As the end credits roll, we see Grace and A.J.'s wedding; the guests include Col. Sharp, Bear, Rockhound & Molly, Lev Andropov, and Chick and his former wife, Denise. In the front row stand the photographs of Harry, Oscar, Max and Noonan - the other lost crew members who are remembered."	spaceThe Day After Tomorrow	"Jack Hall (Dennis Quaid) is a paleoclimatologist who is on an expedition in Antarctica with two colleagues, Frank (Jay O. Sanders) and Jason (Dash Mihok), drilling for ice core samples on the Larsen Ice Shelf for the NOAA when the ice shelf breaks off from the rest of the continent, and Jack almost falls to his death. Jack presents his findings on global warming at a United Nations conference in New Delhi. Jack found that 10,000 years ago, a global warming changed the earth's climate into the Ice Age. Jack says that it could happen again in maybe 100 to 1,000 years from now if we don't stop polluting the atmosphere. Most of the diplomats, including the Vice President of the United States (Kenneth Welsh), are unconvinced by Jack's theory. At the conference, Jack meets Professor Terry Rapson (Ian Holm) of the Hedland Climate Research Centre in Scotland, who is keeping track of the world's ocean currents. Terry tells Jack that the melting of the polar ice caps has poured fresh water into the oceans and diluted the salt level, which has caused the temperature of the ocean currents to drop 13 degrees.Two buoys in the North Atlantic simultaneously show a massive drop in the ocean temperature, and Rapson concludes that melting of the polar ice has begun disrupting the North Atlantic current. He calls Jack, whose paleoclimatological weather model holds reconstructional data of the climate change that caused the first Ice Age, to predict what will happen. Jack believed that the events would not happen for a hundred or a thousand years, but he, Frank, Jason, and NASA's meteorologist Janet Tokada (Tamlyn Tomita) build a forecast model with his, Rapson's, and Tokada's data.All over Earth, the climate system changes for the worst. Tokyo is hit by softball size hail; it begins to snow in New Delhi; and Los Angeles is destroyed by a group of huge F5 tornadoes that hit all at the same time. The U.S. President (Perry King), authorizes the FAA to suspend air traffic over the United States due to severe turbulence. As three RAF helicopters fly to evacuate the British Royal Family from their castle in Scotland, they enter the eye of a very massive hurricane-like superstorm blizzard, that causes a temperature drop of -150 °F that freezes their fuel lines and rotors, causing them to crash down and quickly freeze to death.Meanwhile, Jack's son, Sam, (Jake Gyllenhaal) is in New York City for an academic competition with his friends Brian and Laura (Arjay Smith and Emmy Rossum), where they also befriend a student named J.D. During the competition, the weather becomes massively violent with intense winds and flooding rains. Sam calls his father, making a promise to be on the next train home. Unfortunately, the storm worsens, forcing subways and Grand Central Station to close.Jack sees the President and gives him the bad news that his estimate of years is now down to days, before the planet enters a new Ice Age. Jack advises the President to evacuate everybody in the southern states to Mexico, because it is too late to evacuate the people in the northern states.As the storm worsens in Manhattan, a storm surge almost 40 feet (about half the height of the Statue of Liberty) impacts the island, causing major flooding. Sam and his friends are able to seek refuge in the New York Public Library.Survivors in the Northern United States are forced to flee south, with some Americans illegally crossing the border into Mexico. After advising the Executive Office of the President of the United States to evacuate half the country, Jack sets off for Manhattan to find his son, accompanied by Frank and Jason. Their truck crashes into a snow-covered tractor-trailer just past Philadelphia, so the group continues on snowshoes. During the journey, Frank falls through the glass roof of a snowbound shopping mall. As Jason and Jack try to pull Frank up, the glass under them continues to crack; Frank sacrifices himself by cutting the rope and he dies.The U.S. President's helicopter is caught in the superstorm, killing everyone on board, leaving the U.S. Vice President in charge.Inside the library, Sam advises everyone of his father's instruction to stay indoors. Few listen, and the small group that remains burns books to keep warm and breaks the library's vending machine for food. Laura is afflicted with blood poisoning, so Sam, Brian, and J.D. must search for penicillin in a Russian cargo ship that drifted inland, and are attacked by escaped wolves from the New York Zoo. Just then, the eye of the North American superstorm begins to pass over the city with its -150 °F instant freeze temperatures, and the entire New York City skyline begins to freeze solid, buildings and air alike. The three return to the library with medicine, food, and supplies, making it to safety.During the deep freeze, Jack and Jason take shelter in an abandoned Wendy's restaurant, then resume their journey after the storm dissipates, finally arriving in New York City. They find the library buried in snow, but find Sam's group alive and are rescued by U.S. Army soldiers flying UH-60 Blackhawk helicopters.In Mexico, the new President orders search and rescue teams to look for other survivors, having been given hope by the survival of Sam's group. The movie concludes with two astronauts looking down at Earth from the International Space Station, showing most of the northern hemisphere covered in ice, including all of the United States north of the southern states, and a major reduction in pollution."	earthForbidden Planet 	"When an Earth mission arrives on Altair IV, they find that Dr. Edward Morbius and his beautiful daughter Altaira are the only survivors from the original expedition that had arrived some 20 years before. Morbius isn't exactly pleased to see them and would have preferred that they not even land their spaceship. He does his best to get them on their way but Commander Abrams and his men soon face an invisible force leading them to believe that Morbius and the girl are in danger. Morbius claims to know nothing of other life on the planet but does reveal there once existed a far superior race, now extinct, that left a huge subterranean industrial and scientific complex."	space