title	plot	setFrankenstein	"Dr. Henry Frankenstein (Colin Clive) wants to build a man in his own image, using the body of a dead man. He and his assistant Fritz (Dwight Frye) dig up a freshly buried coffin and steal the body. When they realize the head and the brains of the body are severely damaged, they decide to steal a brain from Dr. Frankenstein's former teacher Dr. Waldman (Edward van Sloan). When Fritz accidentally drops the glass jar with the label ""good brain"" on it, on the floor, he decides to take the glass jar with the label ""bad brain"". Using some kind of mysterious ray that Dr. Frankenstein discovered, the body is brought to life during a thunderstorm, and the monster of Frankenstein (Boris Karloff) is born.Later, when Dr. Frankenstein realizes that he has created an aggressive monster, he and Fritz lock the monster up in a cell. When the monster is repeatedly bullied and provoked by Fritz, the monster eventually manages to kill him. When the monster escapes, he meets a little girl playing near the water. The monster and the girl throw flowers in the water. Enjoying the playing, the clumsy monster proceeds to pick up the girl and throw her in the water too. Later we learn that the little girl drowned in the incident, when her father carries her through the streets.The city's population propel into an uproar, demanding the death of Frankenstein's monster. The monster is driven into an old mill, after which the people of the city set the mill on fire."	earthIsland of Lost Souls	"The castaway Edward Parker is rescued by a cargo ship that is transporting Mr. Montgomery and animals to the notorious scientist Dr. Moreau, who lives in an isolated tiny island in the South Seas. Edwad sends a message to his fiancee Ruth Thomas informing that he is safe and sound and will meet her at Apia. However he has an argument with Captain Davies that tosses him overboard on Dr. Moreau's vessel. The scientist welcomes Edward in his island and offers to transport him on the next day to Apia. Edward sees strange natives and is introduced to the beautiful native Latta. They hear screams from a room called the house of pain by Lotta where Edward sees Dr. Moreau and Montgomery operating a person without anesthetic. But later Montgomery gives a justification to Edward that does not know that Dr. Moreau is performing experiences with animals turning them into people. Further, Dr. Moreau decides to keep Edward in the island since Lolla, who is indeed a panther, is developing human emotions. What will happen to Edward?"	earthThe Fly	"Seth Brundle (Jeff Goldblum) is a brillliant and eccentric inventor. At a party thrown by his financier, Bartok Industries, for the press, Brundle meets Veronica Quaife (Geena Davis), a reporter for Particle Magazine. He invites her to come back to his apartment, where he shows her his latest invention: teleporter pods, or ""telepods,"" that disintegrate matter, transmit it across space, and then reintegrate it. She realizes this could be the invention of the century, and, over Seth's objections, goes to her boss and ex-lover, Stathis Borans (John Getz), to convince him to publish the story. Borans is uninterested, believing the whole thing to be a magic trick. Brundle comes to see her at work, and is relieved that Stathis didn't want to publish the story, because his telepods are not ready to be made public yet. Although they can transmit inanimate matter, it can't handle living things. He offers to let Veronica track his progress as he tries to work out the kinks, if she will wait to write the story until he is finished. She agrees.Veronica ends up spending much of her time at Seth's apartment while he works, and the two of them become more and more attracted to each other. He attempts to send a baboon through the telepods, but it is re-integrated inside out. Soon Veronica falls in love with Seth, and they make love. During the act, she makes an offhand remark about ""the flesh"" driving women crazy. This gives Seth the inspiration he needs: he will teach the computer to be ""driven crazy"" by flesh. Seth continues to work on the telepods while Veronica goes shopping for a gift for him. While shopping, she runs into Stathis again, who now believes that Seth's project is genuine and should be published.Back at Seth's apartment, Veronica watches as Seth puts a second baboon through the telepods, and this time the baboon comes through unharmed. As they prepare to celebrate, however, Veronica finds a package from Stathis. Inside is a design for a cover story on Seth. She runs back to his office to stop him from publishing prematurely, leaving Seth to celebrate alone. He gets drunk and becomes convinced that Veronica is resuming her relationship with Stathis. He decides to teleport himself, as a way to spite Veronica. However, a housefly inadvertently gets into the telepod with him. He teleports to the other pod, and emerges seemingly normal.Veronica comes back to him that night and they reconcile, but his journey through the telepods begins to show some strange side effects. Thick, coarse hairs begin to grow on his back. He develops a intense craving for sugar, his body develops an almost instantly more athletic build, and his sexual stamina is seemingly endless. The sex alone begins to wear out Veronica. Seth suddenly believes that Veronica should go through the teleportation herself, perhaps in a bid to make her as virile as himself. She refuses and, in a sudden burst of uncharacteristic anger, Seth leaves in search of a woman who can keep up with him.At a seedy bar, he meets a woman named Tawny, and arm wrestles with another man to compete over who gets to take her home. Seth wins by breaking the other man's arm with his superhuman strength and because of a white secretion from his hands. After a night of sex and a demonstration of his invention, Tawny pours champagne on his skin, which severely irritates him. He then tries to get her to go through the telepods, but she refuses. Seth tells her not to be afraid, but at that moment Veronica arrives, saying, ""Be afraid. Be very afraid.""Tawny leaves, and Veronica confronts Seth about the changes she has seen in him. Not only is his back growing more hairs, but his face is breaking out in blisters. She then informs him that she had some of his back hairs analyzed, and that that are most likely insect hairs. Seth refuses to believe anything is wrong with him, and he kicks Veronica out of his apartment, his thought processes having become more scattered and irrational.In the bathroom later on, though, Seth does notice more severe changes to himself: his fingernails are falling off and his fingers drip more fluid. His face has more blisters and more of the thick hairs are growing there. He concludes, like Veronica, that something must have gone wrong when he went through the telepods. He checks the record of his teleportation, and his computer tells him that there was a ""secondary element"" in the pod with him, which he recognizes as a housefly. When he asks the computer what happened to the fly, it tells him that he and the fly have been spliced together into a single organism at a genetic and molecular level.A month goes by in which Seth and Veronica do not speak, but finally he contacts her and asks her to see him. When she arrives, she sees that he is frightened and heavily deteriorating. His face is lined with pockmarks, and he needs canes to walk. He has to wear gloves to keep from biting his fingernails off. He eats by vomiting corrosive enzymes onto his food and sucking up the dissolved remains. As they talk, his ear falls off. He refuses to take help from any professional doctors, not wanting to be a lab rat.Veronica goes to Stathis, hoping to find some way to help Seth. He warns her not to go back to him, fearing contagion, but then he asks to go ahead and visit him again to document what is happening, so Stathis can see and find a way to help. She returns to his apartment to find him crawling on the walls and ceiling, as he now realizes what is happening: he is turning into a human-fly hybrid he calls ""Brundlefly,"" and wants Veronica to document his metamorphosis. She records a video where Brundle demonstrates his new eating habits and brings it to Stathis, who watches it in horror. Veronica then shocks Stathis further by telling him she is pregnant with Seth's child.Stathis encourages her to talk to Seth before aborting the baby. When she sees him again, he has deteriorated even further. He no longer wears clothes, his skin has become swollen and lumpy, and more of his body parts have fallen off and he barely resembles his old self. He keeps the sloughed-off parts in a cabinet, dubbing it ""The Brundle Museum of Natural History"". He warns Veronica not to return, because his fly instincts are taking over and he will not be able to keep himself from hurting her. She leaves without telling him she is pregnant, and demands Stathis take her to a doctor for an immediate abortion. Seth overhears them talking, however, and follows them to the doctor's office, where he kidnaps her and takes her back home, asking her to have the baby as it may be the only thing left of his humanity. Veronica is too frightened, thinking there is some kind of monster growing inside her.Stathis follows them to Seth's apartment, armed with a shotgun, but Seth jumps down from the skylight, catching Stathis by surprise. Seeing that Stathis means to shoot him, Seth defends himself by vomiting his digestive enzyme on Stathis' left hand and right foot, melting both appendages and sending Stathis into a state of semi-conscious shock. He is about to vomit on Stathis' face and make him a meal when Veronica, who Seth has kept on the roof, intervenes. Seth lets Stathis live, but asks for Veronica's help to make him human again. When she asks him to explain, he shows her the plan he has created: he wants to use the telepods as a gene-splicer yet again, using them to fuse himself with Veronica and their unborn child, in the hopes that her untainted humanity will be enough to stop the metamorphosis. Veronica resists, but Seth tries to force her into it, saying, ""We'll be the ultimate family."" As she struggles to free herself from Seth's grip, she accidentally rips off his jaw, which sparks the final stages of Seth's transformation. His limbs shed the remainder of their human skin, revealing the insect body underneath. The rest of his face sloughs off to reveal a fly's head.The now completely transformed Brundlefly throws Veronica into one pod, activates the computer and steps into the other. As the countdown to teleportation ticks away, the wounded Stathis comes to his senses. With some effort, he uses his shotgun to shoot the cables connecting Veronica's telepod to the computer, forcing it offline and ensuring Veronica's safety. Brundlefly smashes the door to its telepod and attempts to escape, but the teleportation sequence begins as it is halfway out of the telepod. In a flash, a section of the telepod is transported to the third pod with Brundlefly, causing a shower of sparks. Stathis manages to crawl to Veronica's pod and let her out. The computer, in the meantime, fuses Brundlefly with the section of the telepod that it took. The receiving pod door opens, and Brundlefly collapses onto the floor. As a result of the fusion, most of its body is now a mangled, twisted mass of flesh and machinery.Brundlefly crawls toward Veronica, who arms herself with Stathis' shotgun. Rather than try to harm her, however, Brundlefly uses a claw to point the shotgun barrel at its own head, silently asking Veronica to end its life. She is unable to at first, but seeing that the creature which used to be her lover is horribly deformed and in excruciating pain, she gains enough strength to pull the trigger, blowing apart Brundlefly's head. She sobs, as the film fades out and the credits roll."	earthInvasion of the Body Snatchers	"An apparently delusional and paranoid Dr. Miles Bennell (Kevin McCarthy) has been arrested on a California highway and taken to a local hospital's psychiatric ward. There he tells a psychiatrist, Dr. Hill (Whit Bissell), and the attending physician, Dr. Bassett (Richard Deacon) his fantastic story.Several days earlier, Miles had been called home to Santa Mira from a medical convention. His nurse, Sally Withers (Jean Willes) told him that several patients had come in frantically insisting that their relatives and friends were not who they seemed to be. On the way to the office, Miles and Sally nearly ran over young Jimmy Grimaldi (Bobby Clark) who was fleeing from his mother (Eileen Stevens). Mrs. Grimaldi says Jimmy simply didn't want to go to school. Miles was sad to see that the Grimaldis had shut down their vegetable stand because it was too much work.Later, at his office, Miles learned that many of the patients begging for his return claimed they no longer needed his services. A former girlfriend, Becky Driscoll (Dana Wynter) stopped by. She told him that her cousin, Wilma (Virginia Christine), insisted that her father, Ira (Tom Fadden), wasn't who he seemed to be. Miles agreed to visit Wilma later. Miles and Becky chatted, revealing that they both had recently divorced. After lunch, Jimmy Grimaldi was brought to Miles's office by his grandmother. He insisted that his mother was not really his mother. Suspicious, Miles gave the boy a sedative and told his grandmother to keep the boy at her house that night.Miles and Becky visited Ira and Wilma. Miles admitted his examination of Ira led him to conclude that it was indeed Ira. Wilma insisted that although nothing physically or mentally seemed different about him, his emotional connection to her was wrong. Wilma agreed to see a psychiatrist to discuss her concerns. That night, Becky and Miles went to dinner and encountered the town psychiatrist, Dan Kauffman (Larry Gates), in the parking lot. He mentioned that he too had seen many perplexing cases of people claiming that loved ones had somehow changed.Before they could eat, Miles and Becky were called to the house of Jack and Teddy Belicec (King Donovan and Carolyn Jones). They had found an inert, featureless humanoid creature in their poolroom. Teddy was disturbed by it, and the creature seemed to be taking on Jack's features. It even bled from a hand as Jack did when he cut it on a piece of glass. Miles took Becky home to her father's house. Her father (Kenneth Patterson) seemed normal but Miles was disturbed by something. Returning to the Driscoll house later that night, he broke into the basement and found another humanoid transforming itself into Becky. He snuck upstairs and rescued Becky.Miles and Jack called Dan Kauffman to see the bodies at the Belicecs' and Driscolls'. Both were missing. Dan suggested that they found a real dead human in Jack's poolroom and that its cause of death had been too small for Miles to notice in his examination. He also suggested that Miles saw Becky's double because he had been so unsettled by the mysterious body at the Belicecs'. Becky's father had called the police when he heard Dan, Jack and Miles in his basement. When Police Chief Grivett (Ralph Dumke) arrived, he informed them that a burning body matching the description of what the Belicecs found had been discovered burning outside of town.In town the next day, Miles encountered Wilma who told him she felt better about Ira and didn't need to see Dan. Based on Miles's demeanor she realized he knew something, and told Becky's father, who was hiding in her antique store. At his office, Miles saw Jimmy smiling next to his mother in the waiting room, apparently unconcerned about her anymore. That night, Miles, Becky and the Belicecs planned to barbeque. But Miles found enormous seed pods in his greenhouse. The pods opened up and inert bodies fell out. They quickly began to take the form of Miles and his guests. Miles tried to call the FBI in Los Angeles, Sacramento and Washington D.C. but was told by the operator that the lines are dead. Miles destroyed the creatures, then he and Becky and the Belicecs split up, hoping to get out of town. Miles and Becky stopped for gas. When Miles went to a phone booth to try to reach the FBI again, the gas station attendant placed two pods in the trunk of his car. Miles realized this and destroyed the pods later. He drove to Sally's house. Sneaking up to a window, he saw that she too had been transformed into a pod person and coolly planned to place a seed pod in the crib of her newborn. Miles was discovered by another police officer. Miles and Becky escaped, pursued by the police and other pod people.Miles and Becky hid out in Miles's office. Realizing that the pods were most effective at replacing people when they were asleep, they took amphetamines to stay awake. The next morning, they saw police officers detain people just arriving to town, and watched as transformed citizens accepted pods to take to their relatives in nearby cities. Jack, Dan and Chief Grivett arrived. Miles and Becky were horrified to learn they'd all been transformed. Jack and Dan explained that the pods had arrived from outer space and that the transformation was painless. Soon everyone would be reborn into a better way of life, evolved beyond human emotions like hate and love. Jack and Dan brought pods into Miles's waiting room and locked Miles and Becky in the office. Miles filled three syringes with a sedative, then created a diversion that brought Dan and Jack back into the office. Miles struggled with them but drugged them, with Becky taking care of Grivett.Hoping to pretend to have been transformed by appearing emotionless, Becky and Miles made their way out of the office and into the street. But Becky saw a truck nearly hit a dog and called out in fear. Alerted, the pod people chased Becky and Miles into the hills around Santa Mira. They hid in an abandoned mine. Miles left Becky to try to find help. When he returned, he found Becky asleep. He tried to carry her to safety but learned when he kissed her that she had been transformed too. With other pod people in pursuit, Miles ran to the highway. He pleaded with motorists to stop but they considered him crazy. He saw a truck full of pods headed to Los Angeles. Miles wandered the highway, telling people that ""They're already here! You're next!""Drs. Hill and Basset consider Miles insane and plan his treatment. Then an ambulance brings in a truck driver who had been in an accident. His truck was full of unusual pods, and had been on the road from Santa Mira. Realizing Miles is telling the truth, Dr. Hill immediately calls the police and the FBI."	earth